title,company,location,description,job_link,keywords
Senior Research Scientist (AI/ML),nielseniq,"chennai, tamil nadu, india",company description nielseniq consumer intelligence company delivers full view world complete clear understanding consumer buying behavior reveals new pathway growth since niq moved measurement forward industry economy across globe putting brightest dedicated mind together accelerate progress diversity brings best leave lasting legacy work people nielseniq offer range product service leverage machine learning artificial intelligence provide insight consumer behavior market trend position open opportunity apply latest state art aiml data science global key strategic project job description nielseniqs innovation team growing ai capability looking hire senior research scientist india chennai pune core model team multidisciplinary team researcher working different area ai recommender system extreme classifier large language model llm among others part team stay date latest research ai special focus nlp also computer vision ai related field implement current stateoftheart algorithm realworld largescale challenging problem well proposing novel idea main focus developing customizing llm consumer insight injecting knowledge niqs business fmcg techdurables building downstream application also opportunity produce scientific content patent conferencejournal paper selected candidate also responsible analyzing data researching appropriate technique development testing support delivery proof concept job responsibility investigate develop apply machine learning innovation minimal technical supervision perform feasibility study analyze data determine appropriate solution drive innovation lead work custom large language model work many different data challenge always ensuring combination simplicity scalability reproducibility maintainability within ml solution source code able communicate result tech nontech audience work member team encouraging team building motivation cultivating effective team relation qualification required education skill experience master degree computer science equivalent numerate discipline least year experience evidence related field strong background computer science linear algebra probability solid experience machine learning deep learning special focus transformer proven experience natural language processing large language model able understand scientific paper develop idea executable code proven track record innovation creating novel algorithm publishing ai conferencesjournals applying latest advance ai real world problem data analysis practical handson experience datasets ml model evaluation language technology python pytorch huggingface git pandaspolars sklearn proactive attitude constructive intellectual curiosity persistence find answer question proficient level interpersonal communication skill english level b minimum keen work part diverse team international colleague global inclusive culture additional information preferred education skill experience phd science nlp preferred specialized course one abovementioned field experience working large realworld datasets scalable ml solution previous experience ecommerce retail andor fmcgconsumer insight business agile methodology development scrum scale agile benefit flexible working environment volunteer time linkedin learning employeeassistanceprogram eap niq niq world leading consumer intelligence company delivering complete understanding consumer buying behavior revealing new pathway growth niq combined gfk bringing together two industry leader unparalleled global reach holistic retail read comprehensive consumer insightsdelivered advanced analytics stateoftheart platformsniq delivers full view niq advent international portfolio company operation market covering world population information visit niqcom want keep latest update follow u linkedin instagram twitter facebook commitment diversity equity inclusion niq committed reflecting diversity client community market measure within workforce exist count everyone mission systematically embed inclusion diversity aspect workforce measurement product enthusiastically invite candidate share mission join u proud equal opportunityaffirmative actionemployer making decision without regard race color religion gender gender identity expression sexual orientation national origin genetics disability status age marital status protected veteran status protected class global nondiscrimination policy cover protected class every market business worldwide learn driving diversity inclusion everything visiting niq news center httpsnielseniqcomglobalennewscenterdiversityinclusion,https://www.google.com/search?q=eyJqb2JfdGl0bGUiOiJTZW5pb3IgUmVzZWFyY2ggU2NpZW50aXN0IChBSS9NTCkiLCJjb21wYW55X25hbWUiOiJOaWVsc2VuSVEiLCJhZGRyZXNzX2NpdHkiOiJDaGVubmFpLCBUYW1pbCBOYWR1LCBJbmRpYSIsImh0aWRvY2lkIjoiaXc1c1BUZEdaTmxRV3NiQkFBQUFBQT09IiwidXVsZSI6IncrQ0FJUUlDSUZTVzVrYVdFIiwiaGwiOiJlbiJ9,creating join international journal retail vision encouraging job platform marital open mentioned industry computer also everyone machine technology policy best injecting required problem genetics workforce market market everything cover researching course center always intelligence working feasibility sexual national systematically time nlp git buying clear legacy regard study learn reach holistic scientific instagram discipline position stay minimum date visiting applying analytics global bringing analysis appropriate phd brings evidence senior many business member classifier progress disability trend implement com people additional share economy scrum delivery ecommerce equivalent view range challenge diverse current decision paper equity pytorch every company responsibility answer publishing strong gfk environment development art result persistence strategic concept behavior research since enthusiastically religion analyze technique equal proven core intellectual exist technical information news multidisciplinary field innovation agile description reproducibility pune capability eap downstream growing protected employer consumer measure solid gender product system real proof content advent others develop conference insight linear keen program forward expression pathway two support maintainability scientist inclusive simplicity delivering http extreme visit provide employee panda year without analyzing scalability new advance candidate least deep find related mission learning responsible reveals portfolio twitter artificial dedicated lasting leader previous polars driving one effective fmcg nielseniq leverage brightest origin team developing tech candidate knowledge communication algorithm numerate color question project language algebra veteran moved insight constructive proposing idea evaluation orientation model status key python audience conference race special level custom putting accelerate across novel proactive client want reflecting offer non methodology operation huggingface language facebook researcher leading track determine sklearn source skill practical curiosity globe drive datasets patent revealing community science cultivating produce action executable mind english combined class focus well commitment large proficient lead growth understanding opportunity processing looking world motivation background hire testing identity record among ensuring full area proud volunteer class update assistance building code india keep experience niq perform colleague benefit preferred culture part aspect discrimination delivered recommender innovation latest attitude invite worldwide affirmative challenging complete application within minimal linkedin population hand investigate service understand degree scale advanced work interpersonal covering together measurement unparalleled inclusion llm field supervision making selected embed comprehensive data journal master count combination solution apply natural probability able different communicate follow durables specialized customizing transformer relation main flexible diversity education read industry state delivers solution committed qualification scalable age chennai leave
"Research Scientist, Language",google deepmind,"karnataka, india",research scientist language snapshot language team google deepmind india driven mission make ai linguistically inclusive push boundary multilingual multimodal large language model llm work also encompasses modularity composition aiming make llm responsible culturally aware furthermore prioritize method high quality data curation representative evaluation ensure advancement inclusive reflective diverse linguistic context user need addition fundamental research apply research advance critical product launch google touching life hundred million user looking forward u artificial intelligence could one humanity useful invention google deepmind team scientist engineer machine learning expert working together advance state art artificial intelligence use technology widespread public benefit scientific discovery collaborate others critical challenge ensuring safety ethic highest priority role research scientist google deepmind lead effort developing novel algorithmic architecture towards end goal solving building artificial general intelligence pioneered research world leading academic industrial lab phd postdoc professorship research scientist join google deepmind work collaboratively within across research field develop solution fundamental question machine learning ai key responsibility design implement evaluate model agent software prototype language processing report present research finding development including status result clearly efficiently internally externally verbally writing suggest engage team collaboration meet ambitious research goal work external collaborator maintain relationship relevant research lab key individual appropriate work collaboration responsible ai team ensure advance intelligence developed ethically provide broad benefit humanity order set success research scientist google deepmind india look following skill experience phd technical field equivalent practical experience addition following would advantage phd natural language processing machine learning related area proven track record publication relevant experience one area multilingual modeling multimodality large language model evaluation etc real passion ai language,https://www.google.com/search?q=eyJqb2JfdGl0bGUiOiJSZXNlYXJjaCBTY2llbnRpc3QsIExhbmd1YWdlIiwiY29tcGFueV9uYW1lIjoiR29vZ2xlIERlZXBNaW5kIiwiYWRkcmVzc19jaXR5IjoiS2FybmF0YWthLCBJbmRpYSIsImh0aWRvY2lkIjoieFg2V1hJSHBwRS1BX2dBREFBQUFBQT09IiwidXVsZSI6IncrQ0FJUUlDSUZTVzVrYVdFIiwiaGwiOiJlbiJ9,useful user join broad google efficiently clearly industrial culturally aiming widespread lab post building art team developing result quality make india linguistically expert experience general public context also encompasses collaboratively following research reflective machine benefit ensure question technology proven highest relationship language doc engage invention set method ethic effort technical touching development snapshot prioritize life evaluation verbally academic field model status key curation externally developed use driven external passion advantage boundary intelligence working within across novel order software benefit agent goal goal relevant language advance team real modeling success high maintain work leading discovery humanity furthermore together track writing multilingual others prototype develop million llm skill scientific field practical need publication forward could collaboration representative including data report meet scientist inclusive push look apply role natural appropriate phd solving evaluate hundred provide humanity modularity collaborator architecture deepmind ethically towards aware advance phd implement critical launch priority addition professorship safety design large mission related finding multimodality collaborate lead scientist learning responsible state present user processing end fundamental looking artificial algorithmic world engineer pioneered equivalent product solution diverse challenge internally etc composition suggest record ensuring one collaboration area individual ambitious advancement responsibility multimodal linguistic would evaluation
Senior AI Scientist,ge healthcare,"bengaluru, karnataka, india",job description summary personalization healthcare identified key growth area ge healthcare gehc advanced technology group play key role developing targeted solution meet goal precision medicine gehc ongoing multidisciplinary program digital molecular pathology tissue imaging diagnostic imaging mri ct pet ultrasound physiological monitoring ecg u eeg etc informatics approach identify clinically relevant biosignatures believe ai quickly accurately identify sign disease medical image like mri ct scan ultrasound xrays therefore allow faster diagnostics positively impact patient outcome team leading ai effort advancing care pathway improving organization treatment plan analyzing data provide better treatment plan monitoring treatment ai play central role initiative breakthrough resulting image interpretation identifying imaging biomarkers many application including tissue characterization analyzing physiological data patient care solution many instance accelerating clinical workflow healthcare cost reduced team innovate execute rd strategy around image analytics aligned gehc business initiative broad set area patient monitoring mri ct ultrasound xray cell therapy molecular diagnostics etcdrive cutting edge research core imaging signal processing problem participate strategic collaboration top university pharmabiotech publish key conference journal well generate core ip ge healthcare leading global medical technology digital solution innovator mission improve life moment matter unlock ambition turn idea worldchanging reality join organization every voice make difference every difference build healthier world job description role responsibility senior ai scientist part data science team working commerciallyfacing development project typically involving large complex data set advanced technology group focused signal image processing ultrasound mri ct xray physiological monitoring data well real time image analysis industrial application candidate highly passionate enthusiastic player solving problem medical imaging building implementing algorithm image processing machine learning deep learning senior ai scientist domain medical imaging responsible research design implementation algorithm multiple modality spanning ultrasound mr ct xray patient monitoring life science application advance stateoftheart field including generating patent publication top journal conference participate cutting edge research artificial intelligence machine learning application develop solution real world large scale problem work technology accelerate workflow optimizes patient specific imaging create device agnostic imaging algorithm fast prototyping feasibility study specification implementation medical imaging product component build partnership clinical site university drive clinical innovation area brain health work customer understand algorithm workflow requirement deliver solution qualification requirement phdmasters computer science machine learning electrical engineeringelectronics communication engineering minimum year experience specializing medical imaging excellent foundation design analysis implementation algorithm basic understanding machine learning computer vision deep learning preferred expertise experience machine learning applied mathematics computer vision field excellent theoretical practical background machine learning deep learning statistical pattern recognition applied mathematics medical imaging natural language processing text understanding classification pattern recognition experience publishing record journal international repute conference isbi iclr nip ohbm others familiarity python c deep learning library must outstanding interpersonal communication skill exceptional team player ability prioritize work proven experience ai deep learning machine learning applied mathematics computer vision field leadership demonstrated skill working team setting demonstrated skill critical thinking problemsolving method demonstrated skill presentation influencing skill personal attribute demonstrated awareness succeed ambiguous circumstance inclusion diversity ge healthcare equal opportunity employer inclusion matter employment decision made without regard race color religion national ethnic origin sex sexual orientation gender identity expression age disability protected veteran status characteristic protected law expect employee live breathe behavior act humility build trust lead transparency deliver focus drive ownership always unyielding integrity total reward designed unlock ambition giving boost flexibility need turn idea worldchanging reality salary benefit everything youd expect organization global strength scale youll surrounded career opportunity culture foster care collaboration support liam lihybrid additional information relocation assistance provided yes,https://www.google.com/search?q=eyJqb2JfdGl0bGUiOiJTZW5pb3IgQUkgU2NpZW50aXN0IiwiY29tcGFueV9uYW1lIjoiR0UgSEVBTFRIQ0FSRSIsImFkZHJlc3NfY2l0eSI6IkJlbmdhbHVydSwgS2FybmF0YWthLCBJbmRpYSIsImh0aWRvY2lkIjoiaDl2Z3Z0dVppTk9tOXhOREFBQUFBQT09IiwidXVsZSI6IncrQ0FJUUlDSUZTVzVrYVdFIiwiaGwiOiJlbiJ9,therapy publish positively informatics join broad international edge industrial image journal biomarkers vision expertise job participate foster computer commercially initiative effort machine medical technology ultrasound need specification set reality pattern problem pathology life familiarity expect resulting everything outcome life identify university setting working intelligence always feasibility matter sexual national requirement time advance regard study specializing set care customer identifying electronics unyielding domain play minimum analytics global analysis role phd area component senior many business matter treatment disability additional accurately therefore agnostic aligned product etc awareness cell cutting decision highly player every site sex hybrid specific responsibility image publishing provided generate sign trust development art enthusiastic healthcare accelerating strategic passionate treatment career research imaging electrical religion equal disciplinary proven opportunity core outstanding method information turn field innovation presentation description around mathematics like protected employer reduced gender goal going implementation real total mri eeg focused others giving develop cost faster top program collaboration designed expression including ability engineering support scientist influencing biotech personalization solving text execute provide year salary without analyzing yes involving thinking quickly candidate flexibility deep design ethnic mission biosignatures generating learning responsible succeed scan artificial diagnostic ohbm isbi instance characterization physiological technology gehc surrounded group origin advancing team repute algorithm developing organization must law difference fast strategy breathe communication act algorithm color impact project language statistical believe veteran device targeted deliver ambiguous complex prioritize idea unlock science orientation status key python race conference ray brain accelerate role ambition diagnostics relevant plan leading facing ecg health identified skill recognition patient practical voice publication drive disease medicine live prototyping patent modality science integrity made innovate moment central circumstance focus well large pathway lead employment growth digital understanding processing opportunity world transparency clinical background partnership identity record collaboration area create boost applied skill ownership assistance building characteristic experience monitoring implementing precision problem benefit preferred improve culture part optimizes behavior interpretation nip reward relocation classification pharma approach application demonstrated humility multiple iclr ray better understand molecular team scale advanced strength work interpersonal workflow foundation attribute spanning inclusion basic summary field workflow data master tissue signal natural leadership typically meet pet build build allow changing theoretical make improving diversity critical clinically healthier personal multi initiative state library employee solution excellent breakthrough qualification age innovator exceptional
AI Researcher & Implementer Fresher Job,growify digital,"new delhi, delhi, india",job key responsibility research ai tool technology applicable ecommerce digital marketing evaluate ai platform content creation data analysis campaign optimization customer segmentation analyze existing marketing workflow seo paid ad social medium etc pinpoint inefficiency develop proposal aidriven solution improve operational efficiency collaborate marketing department understand unique need assist integration deployment selected ai tool conduct testing evaluation implemented ai solution create documentation training material team member analyze data generated ai tool measure performance prepare report presentation summarizing finding recommendation interpret data provide recommendation marketing staff requirement strong interest ai application digital marketing basic understanding machine learning concept analytical problemsolving ability excellent communication collaboration skill currently enrolled recent graduate bachelorsmasters program computer science data science ai marketing related field apply candidate apply computer science engineering student salary year experience year deadline skill required javascript artificial intelligence company ecommerce salesoriented agency focused fashion industry india work partner client taking digital channel monetize everything setting website account channel running ad across various digital channel inhouse sale finally even managing payment collection order fulfillment coordinating production customer incentive achieve sale get paid sale cut thus true partner client achieve best business uniqueness stem techoriented approach marketing diligence sale,https://www.google.com/search?q=eyJqb2JfdGl0bGUiOiJBSSBSZXNlYXJjaGVyIFx1MDAyNiBJbXBsZW1lbnRlciBGcmVzaGVyIEpvYiIsImNvbXBhbnlfbmFtZSI6Ikdyb3dpZnkgRGlnaXRhbCIsImFkZHJlc3NfY2l0eSI6Ik5ldyBEZWxoaSwgRGVsaGksIEluZGlhIiwiaHRpZG9jaWQiOiJfdmM2RWZzdjBrQ0ljTmNCQUFBQUFBPT0iLCJ1dWxlIjoidytDQUlRSUNJRlNXNWthV0UiLCJobCI6ImVuIn0=,strong diligence unique cut implemented deadline team website coordinating job platform tech candidate india recent account experience fashion marketing computer partner documentation concept interest communication bachelor research finally department machine problem prepare analyze improve agency production technology graduate collection assist report creation best paid required field payment uniqueness key medium ability social performance everything material driven incentive member setting intelligence client across order various achieve measure understand existing requirement channel segmentation work content workflow focused oriented enrolled develop basic skill customer integration house generated sale program need get selected approach data inefficiency master even engineering monetize deployment taking tool analysis stem apply javascript solving recommendation summarizing science evaluate provide interpret pinpoint applicable salary training conduct student business proposal ad seo application operational running optimization true industry customer related finding collaborate learning digital analytical staff understanding campaign artificial solution fulfillment testing excellent efficiency etc thus presentation collaboration currently company year create responsibility commerce managing evaluation
Artificial Intelligence Researcher,birbal ai,"chennai, tamil nadu, india",company description birbal ai leading way developing aidriven solution empower business individual mission revolutionize work process providing efficient creative tailored ai tool adapt need client focus innovation empowerment help client achieve goal drive impact rapidly changing world role description fulltime onsite role artificial intelligence researcher birbal ai ai researcher responsible conducting research computer science pattern recognition data science statistic related area role involve developing innovative ai solution drive productivity innovation within organization qualification computer science data science skill experience pattern recognition statistic strong research skill ability work independently collaboratively excellent problemsolving analytical skill phd computer science artificial intelligence related field previous experience ai research development,https://www.google.com/search?q=eyJqb2JfdGl0bGUiOiJBcnRpZmljaWFsIEludGVsbGlnZW5jZSBSZXNlYXJjaGVyIiwiY29tcGFueV9uYW1lIjoiQmlyYmFsIEFJIiwiYWRkcmVzc19jaXR5IjoiQ2hlbm5haSwgVGFtaWwgTmFkdSwgSW5kaWEiLCJodGlkb2NpZCI6IjhEcGtaSzF5OTZhQzVtcnRBQUFBQUE9PSIsInV1bGUiOiJ3K0NBSVFJQ0lGU1c1a2FXRSIsImhsIjoiZW4ifQ==,strong empowerment revolutionize development developing organization productivity experience computer rapidly collaboratively research problem statistic tailored independently impact innovation help pattern field description site process driven intelligence within client achieve goal birbal time work leading adapt skill recognition need drive researcher efficient data ability tool role solving science creative changing empower innovative focus mission related responsible analytical world artificial involve solution excellent conducting previous business full qualification way area company individual providing
