title,company,location,description,job_link,keywords
Research Intern – Generative AI Agents,synergylabs,"gurugram, haryana, india",job title research intern generative ai agent location gurugram duration month stipend inr u technologydriven startup exploring future aipowered agent automation mission build scalable solution using cuttingedge generative ai llm autonomous agent solve realworld problem join u youre curious innovative ready get hand dirty ai research role overview research intern dive deep world generative ai agent large language model llm autonomous multiagent system youll help u map landscape explore technical capability evaluate tool contribute prototype development key responsibility conduct comprehensive research generative ai agent llmbased agent autonomous agent framework analyze recent paper blog github project industry update related ai agent benchmark compare agent framework toolkits performance capability realworld application support team prototyping basic agent workflow simulation prepare detailed report documentation presentation material internal knowledge sharing identify gap opportunity potential use case ai agent specific industry eg ecommerce finance customer support assist writing proofofconcept code python j relevant language test different agent architecture preferred skill qualification pursuing degree computer science aiml data science related field strong interest ai llm multiagent system knowledge generative ai concept openai apis langchain similar tool bonus handson experience python familiarity prompt engineering finetuning model plus ability read summarize research paper effectively excellent analytical writing presentation skill curious mindset willing experiment learn share knowledge youll gain exposure latest advancement generative ai agent autonomous system handson research prototyping experience opportunity work closely founder tech lead career mentorship aiml potential fulltime conversion top performer,https://www.google.com/search?q=eyJqb2JfdGl0bGUiOiJSZXNlYXJjaCBJbnRlcm4g4oCTIEdlbmVyYXRpdmUgQUkgQWdlbnRzIiwiY29tcGFueV9uYW1lIjoiU3luZXJneUxhYnMiLCJhZGRyZXNzX2NpdHkiOiJHdXJ1Z3JhbSwgSGFyeWFuYSwgSW5kaWEiLCJodGlkb2NpZCI6IlNYcXBFVmNnYnRnd1BvN1VBQUFBQUE9PSIsInV1bGUiOiJ3K0NBSVFJQ0lGU1c1a2FXRSIsImhsIjoiZW4ifQ==,duration effectively sharing join technology strong edge update exploring test lead development team code summarize closely job tech exposure recent knowledge experience industry computer tuning framework career documentation concept ready interest blog founder research simulation powered month openai preferred prepare analyze opportunity landscape project language benchmark report assist latest map technical help concept problem based field familiarity prompt model presentation key python title performer performance location github use capability mentorship using driven material application identify gurugram hand agent conversion gain relevant automation system degree real agent proof time work specific workflow writing learn potential generative llm basic prototype skill future top get experiment comprehensive data bonus ability engineering pursuing support prototyping explore curious architecture tool llm willing role science different evaluate overview detailed inr contribute conduct similar build compare dirty dive mindset gap case innovative stipend deep multi share read industry large customer mission related toolkits plus analytical opportunity apis fine internal world solution excellent autonomous cutting langchain paper solve startup full qualification scalable finance intern advancement responsibility commerce
Lead Researcher - Image AI,"dolby laboratories, inc.","bengaluru, karnataka, india",join leader entertainment innovation help u design future dolby science meet art high tech mean computer code member dolby team youll see hear result work everywhere movie theater smartphones continue revolutionize people create deliver enjoy entertainment worldwide need absolute best talent opportunity play key role dolby new rd center bangalore research lead advanced technology group atg research technology arm dolby lab multiple competency innovate technology audio video arvr gaming music broadcast usergenerated content area expertise related computer science electrical engineering aiml computer vision data science analytics distributed system cloud edge mobile computing natural language processing social network analysis computer graphic highly relevant research youll lead researcher within dolby atg research focus three key area responsibility stateof art cutting edge handson research researcher invent develop next generation ai driven image video analysis enhancement processing technology jointly dolby worldclass global research team set direction identify project build next wave image technology driving dolby cloud licensing business solid understanding traditional image processing newer ai technology perform research using signal processing based solution also work intersection classical image processing new ai algorithm apply insight research image delivery analysis content creation technology managing nurturing grooming top research talent senior leader manage mentor small group researcher working image processing computer graphic computer science content enhancement work team coach mentor passionate developing junior highly talented staff researcher work fully independently corporate environment contribute developing dynamic flexible transparent resultsoriented innovative working atmosphere technology strategy direction setting jointly dolby worldclass global research team set direction identify project build next wave ai based technology driving dolby cloud licensing business work atg technology leader codefine project assign staff global rd initiative led technology initiative lead work jointly upper management lead resource work allocation also work dolby business group bg bring research life many product working closely product manager program manager bg engineering team worldwide education desired experience phd plus year corporate research experience degree physic electrical engineering mathematics computer science deep understanding strong record research computer vision image analysis enhancement compression processing technology absolute top expert ai deep thorough theoretical understanding latest stateof art ai technology detailed understanding main network architecture deployment mode data augmentation preparation theoretical performance analysis model architecture knowledge nlp andor multimodal architecture highly desired good understanding diffusion autoregressive generative model selfsupervised contrastive learning autoencoders audio image text application source separation texttospeech music synthesis image segmentation image captioning question answering language model etc knowledge game environment graphical processing consumer product soc architecture embedded software gpucpu implementation algorithm validation testing implementation mlai algorithm demonstrated ability create fundamentally new novel patentable image processing enhancement rendering technology strong publication record major imagevideoai conference journal eg neurips iclr icml etc strong track inventing developing productizing video technology industrial research environment ability envision application new technology form innovative product solution strong innovator highly skilled cc python experience managing guiding mentoring younger researcher teamoriented work ethic interest work crosscontinental team strong personal interest learning researching creating relevant new technology high commercial impact excellent communication collaboration presentation skill english official communication regarding employment opportunity dolby come official dolbycom email address never request payment part hiring process receive suspicious message please verify authenticity responding lisb,https://www.google.com/search?q=eyJqb2JfdGl0bGUiOiJMZWFkIFJlc2VhcmNoZXIgLSBJbWFnZSBBSSIsImNvbXBhbnlfbmFtZSI6IkRvbGJ5IExhYm9yYXRvcmllcywgSW5jLiIsImFkZHJlc3NfY2l0eSI6IkJlbmdhbHVydSwgS2FybmF0YWthLCBJbmRpYSIsImh0aWRvY2lkIjoiNFVlNk9Db1VrQTVrX3d0QkFBQUFBQT09IiwidXVsZSI6IncrQ0FJUUlDSUZTVzVrYVdFIiwiaGwiOiJlbiJ9,distributed supervised auto creating join edge industrial image journal vision lab inventing expertise traditional cloud computer also initiative need technology creation enhancement best enjoy set newer arm verify email envision small performance researching using life center identify dynamic setting working software direction younger segmentation nlp high environment thorough play allocation upper cpu analytics global analysis role manager senior many define official augmentation business member group request com people separation soc delivery modal product etc cutting highly fundamentally graphical managing mentor strong major audio talented manage environment neurips art authenticity result publication passionate smartphones research corporate suspicious electrical assign opportunity independently transparent help coach good mode presentation captioning embedded mathematics driven fully consumer solid atmosphere product implementation system validation junior content hiring develop music never broadcast program top researcher classical ability engineering gpu continental architecture text everywhere nurturing detailed year intersection new talent ethic graphic model deep design jointly related network learning plus commercial atg please synthesis guiding leader responsibility driving generation bring technology gaming entertainment dolby revolutionize group rendering theater team algorithm developing tech knowledge interest mobile strategy speech communication algorithm preparation project language impact deliver diffusion insight based model key python conference novel mean competency relevant message researcher movie wave oriented track physic source skill computing encoders self deployment see science contribute question innovate led english productizing class focus skilled lead employment process user staff understanding opportunity processing world autoregressive desired testing implementation record absolute collaboration area create regarding expert icml cross receive lead code closely experience contrastive perform game next mentoring part address innovation patentable latest worldwide leader bangalore payment social application demonstrated within multiple iclr hand team degree advanced work answering video generative hear grooming generated future direction management data three signal apply invent resource natural form meet build theoretical main flexible come licensing education innovative personal compression multi continue initiative state responding solution excellent innovator
AI Researcher,digital green,"karnataka, india",ai researcher language voice image report ai director technology digital green digital green pioneer global profit organization utilizing digital platform communitydriven approach amplify voice smallholder farmer improve livelihood mission create world farmer use technology data build prosperous community harnessing power technology facilitate knowledge sharing capacity building market linkage enabling farmer adopt sustainable agricultural practice increase productivity income dedicated transforming life underserved smallholder farmer worldwide innovative technology solution backed leading philanthropic organization bill melinda gate foundation bmgf walmart foundation usaid uk foreign commonwealth development office ukfcdo committed leveraging data technology empower smallholder farmer strengthen agricultural extension system job summary ai researcher digital green forefront innovation driving development language voice computer vision model specifically tailored agricultural domain work directly contribute enhancing capability conversational bot voiceenabled interface computer vision system enabling effectively understand respond user query local language recognize speech accurately analyze agricultural image role focus leveraging cuttingedge machine learning technique address key challenge faced smallholder farmer ultimately driving positive impact transformation agricultural practice livelihood key responsibility domainspecific language modeling develop domainspecific language model trained agricultural text data improve bot ability understand generate content related farming practice crop management pest control weather forecasting relevant topic includes enhancing comprehension generation local language commonly used farmer designing algorithm recognize interpret agricultural terminology abbreviation regional dialect voice recognition model development develop optimize automatic speech recognition asr model native language spoken smallholder farmer incorporating domainspecific terminology regional dialect using advanced technique like deep learning transfer learning data augmentation ensure high accuracy reliability realworld setting computer vision model development design develop computer vision model generative ai algorithm agricultural application including plant disease detection field infestation monitoring crop detection image generation textual description utilizing real data collected agricultural field remote sensing platform data collection annotation formulate coordinate comprehensive plan program team thirdparty service collect annotate ensure highquality agricultural text speech image data local language capturing diverse linguistic variation agricultural context image scenario training finetuning model model training optimization evaluation train optimize language asr computer vision model using stateoftheart technique achieve high accuracy reliability evaluate model performance using key metric accuracy word error rate precision recall f score iteratively refine model based feedback insight collaboration integration collaborate closely software engineer data scientist agricultural expert product manager integrate ai capability digital green platform ensuring seamless functionality user experience share insight learning internal team government partner stakeholder facilitate knowledge transfer capacity building continuous improvement knowledge sharing stay updated latest advancement nlp asr computer vision research technique continuously refining optimizing model deliver stateoftheart performance document model architecture training procedure best practice share knowledge crossfunctional team stakeholder qualification education phd master degree computer science artificial intelligence engineering related field focus nlp speech recognition computer vision experience proven experience year ai research strong track record developing language model asr model computer vision algorithm experience agricultural domain plus programming skill proficiency python experience machine learning framework library tensorflow pytorch hugging face transformer kaldi mozilla deepspeech opencv kera analytical skill strong analytical problemsolving skill ability critically evaluate research paper design experiment interpret result domain knowledge familiarity agricultural practice terminology plant biology crop disease field monitoring technique demonstrated ability customize ai solution domainspecific requirement communication skill excellent interpersonal communication skill ability collaborate effectively crossfunctional team stakeholder communicate technical concept nontechnical audience compensation application process digital green trust great place work pride competitive comprehensive compensation benefit package digital green trust proud equal opportunity employer qualified applicant receive consideration employment without regard race color religion sex national origin disability status protected veteran status characteristic protected law please send application along updated cv cover letter explaining suitability position completed application applied join u digital green leverage expertise ai transform agricultural practice improve livelihood smallholder farmer worldwide kssexd,https://www.google.com/search?q=eyJqb2JfdGl0bGUiOiJBSSBSZXNlYXJjaGVyIiwiY29tcGFueV9uYW1lIjoiRGlnaXRhbCBHcmVlbiIsImFkZHJlc3NfY2l0eSI6Ikthcm5hdGFrYSwgSW5kaWEiLCJodGlkb2NpZCI6IjQxV2xTbWQ5XzQzaXlocmpBQUFBQUE9PSIsInV1bGUiOiJ3K0NBSVFJQ0lGU1c1a2FXRSIsImhsIjoiZW4ifQ==,sharing join edge image query vision expertise platform job forefront abbreviation harnessing computer framework government pride machine amplify terminology customize collection farmer best seamless hugging life reliability familiarity applicant market performance using intelligence software transfer national requirement optimizing power explaining modeling nlp high refine kaldi regard variation opencv position domain served stay coordinate global commonwealth role annotate manager augmentation walmart remote disability mozilla share increase optimization transform learning accurately local procedure philanthropic place product challenge diverse word cutting paper faced pytorch sex crop specific responsibility image strong plan generate trust development art integrate result refining optimize partner concept research religion analyze disease technique equal voice proven utilizing plant technical ukfcdo farming field pest directly programming leveraging agricultural use capability like driven protected employer feedback continuous trained system real rate content positive experiment develop native program researcher consideration focus including ability engineering topic setting architecture extension text specifically solving evaluate year face without dialect scenario empower bill detection model deep design mission related transformation learning scientist plus enabled analytical please adopt fine artificial compensation dedicated engineer terminology capturing accuracy backed updated metric driving generation effectively technology smallholder leverage capacity origin error regional organization developing quality law knowledge productivity expert completed context speech communication biology algorithm color ensure tailored impact language report stakeholder foundation used veteran deliver spoken insight based model status key python tensorflow audience race transforming competitive along non textual iteratively interface relevant language conversational leading strengthen enhancing track functional skill letter integration recognition voice automatic weather disease annotation community science gate green contribute training formulate foreign application description focus comprehension collaborate proficiency process respond employment pioneer digital user sustainable train opportunity internal world functionality kera bmgf critically record ensuring collaboration create advancement linguistic evaluation proud applied director income cross receive building closely recognize qualified practice document recall experience monitoring tuning profit prosperous precision problem benefit package commonly improve continuously deepspeech address innovation improvement latest score worldwide third approach control application demonstrated send achieve designing understand service cover degree team sensing advanced work interpersonal enabling melinda generative office summary field collected management organization comprehensive data master livelihood community linkage communicate interpret includes bot characteristic collect suitability ultimately build asr transformer party usaid education great innovative forecasting state library solution excellent facilitate committed incorporating qualification infestation
